{
  "$schema": "./client.schema.json",
  "min_chat_delay": 0,
  "min_hair_style": 0,
  "max_hair_style": 42,
  "min_hair_color": 0,
  "max_hair_color": 8,
  "min_cloth_color": 0,
  "max_cloth_color": 7,
  "min_body_style": 0,
  "max_body_style": 1,
  "hide_woe_damage": false,
  "pet_hair_style": 100,
  "area_size": 14,
  "max_walk_path": 17,
  "max_lv": 99,
  "aura_lv": 99,
  "client_limit_unit_lv": 0,
  "wedding_modifydisplay": false,
  "save_clothcolor": true,
  "save_body_style": true,
  "wedding_ignorepalette": false,
  "xmas_ignorepalette": false,
  "summer_ignorepalette": false,
  "hanbok_ignorepalette": false,
  "oktoberfest_ignorepalette": false,
  "motd_type": 0,
  "display_version": true,
  "display_hallucination": true,
  "display_status_timers": true,
  "client_reshuffle_dice": true,
  "client_sort_storage": false,
  "update_enemy_position": true,
  "spawn_direction": false,
  "mvp_exp_reward_message": false,
  "ping_timer_inverval": 30,
  "ping_time": 20,
  "show_skill_scale": true,
  "drop_connection_on_quit": false,
  "macro_detection_retry": 3,
  "macro_detection_timeout": 60000,
  "macro_detection_punishment": 0,
  "macro_detection_punishment_time": 0,
  "macrochecker_delay": 600000
}